{
  "$schema": "http://json-schema.org/draft-07/schema#",
  "title": "Theme",
  "description": "Design token theme file for the Situation Room dashboard",
  "type": "object",
  "required": ["name", "palette", "colors", "shadcn", "typography", "geometry"],
  "additionalProperties": false,
  "properties": {
    "name": {
      "type": "string",
      "enum": ["Light", "Dark"],
      "description": "Theme identifier. 'Light' maps to :root, 'Dark' maps to .dark"
    },
    "palette": {
      "type": "object",
      "description": "Raw color values. Hex (#rrggbb), oklch(), or CSS keywords.",
      "properties": {
        "transparent": { "type": "string", "const": "transparent" }
      },
      "required": ["transparent"],
      "additionalProperties": {
        "oneOf": [
          { "type": "string" },
          { "type": "array", "items": { "type": "string" }, "minItems": 1 }
        ]
      }
    },
    "colors": {
      "type": "object",
      "description": "Semantic color mappings using palette refs (e.g. 'gray.3', 'white')",
      "additionalProperties": {
        "type": "object",
        "additionalProperties": { "type": "string" }
      }
    },
    "shadcn": {
      "type": "object",
      "description": "shadcn compatibility tokens mapping to colors refs",
      "required": [
        "background",
        "foreground",
        "card",
        "cardForeground",
        "popover",
        "popoverForeground",
        "primary",
        "primaryForeground",
        "secondary",
        "secondaryForeground",
        "muted",
        "mutedForeground",
        "accent",
        "accentForeground",
        "destructive",
        "border",
        "input",
        "ring",
        "sidebar",
        "sidebarForeground",
        "sidebarPrimary",
        "sidebarPrimaryForeground",
        "sidebarAccent",
        "sidebarAccentForeground",
        "sidebarBorder",
        "sidebarRing"
      ],
      "additionalProperties": { "type": "string" }
    },
    "typography": {
      "type": "object",
      "required": ["fontFamily", "fontSize", "fontWeight"],
      "properties": {
        "fontFamily": {
          "type": "object",
          "additionalProperties": { "type": "string" }
        },
        "fontSize": {
          "type": "object",
          "additionalProperties": { "type": "string" }
        },
        "fontWeight": {
          "type": "object",
          "additionalProperties": { "type": "string" }
        }
      },
      "additionalProperties": false
    },
    "geometry": {
      "type": "object",
      "required": ["radiusBase", "radiusScale", "shadow"],
      "properties": {
        "radiusBase": {
          "type": "string",
          "description": "CSS length value, e.g. '0.375rem'"
        },
        "radiusScale": {
          "type": "object",
          "additionalProperties": { "type": "number", "exclusiveMinimum": 0 }
        },
        "shadow": {
          "type": "object",
          "additionalProperties": { "type": "string" }
        }
      },
      "additionalProperties": false
    },
    "components": {
      "type": "object",
      "description": "Dashboard component token mappings (geometry refs or literal CSS values)",
      "additionalProperties": {
        "type": "object",
        "additionalProperties": { "type": ["string", "number"] }
      }
    },
    "dashboard": {
      "type": "object",
      "description": "Dashboard semantic color mappings using colors refs",
      "additionalProperties": {
        "type": "object",
        "additionalProperties": { "type": "string" }
      }
    },
    "viz": {
      "type": "object",
      "required": ["categorical", "sequential", "diverging"],
      "properties": {
        "categorical": {
          "type": "array",
          "items": { "type": "string" },
          "minItems": 3
        },
        "sequential": {
          "type": "array",
          "items": { "type": "string" },
          "minItems": 3
        },
        "diverging": {
          "type": "array",
          "items": { "type": "string" },
          "minItems": 3
        }
      },
      "additionalProperties": false
    }
  }
}
