{
  "name": "Light",

  "palette": {
    "transparent": "transparent"
  },

  "colors": {
    "surface":     { "base": "#ffffff", "elevated": "#f8f9fa", "sunken": "#f1f3f5" },
    "border":      { "subtle": "#f0f0f0" },
    "text":        { "primary": "#111827", "secondary": "#6b7280", "tertiary": "#9ca3af" },
    "positive":    { "default": "#059669", "bg": "#ecfdf5" },
    "negative":    { "default": "#dc2626", "bg": "#fef2f2" },
    "neutral":     { "change": "#6b7280" },
    "accentBrand": { "default": "#1e40af", "subtle": "#eff6ff" }
  },

  "shadcn": {
    "background":                "oklch(1 0 0)",
    "foreground":                "oklch(0.145 0 0)",
    "card":                      "oklch(1 0 0)",
    "cardForeground":            "oklch(0.145 0 0)",
    "popover":                   "oklch(1 0 0)",
    "popoverForeground":         "oklch(0.145 0 0)",
    "primary":                   "oklch(0.205 0 0)",
    "primaryForeground":         "oklch(0.985 0 0)",
    "secondary":                 "oklch(0.97 0 0)",
    "secondaryForeground":       "oklch(0.205 0 0)",
    "muted":                     "oklch(0.97 0 0)",
    "mutedForeground":           "oklch(0.556 0 0)",
    "accent":                    "oklch(0.97 0 0)",
    "accentForeground":          "oklch(0.205 0 0)",
    "destructive":               "oklch(0.577 0.245 27.325)",
    "border":                    "oklch(0.922 0 0)",
    "input":                     "oklch(0.922 0 0)",
    "ring":                      "oklch(0.708 0 0)",
    "sidebar":                   "oklch(0.985 0 0)",
    "sidebarForeground":         "oklch(0.145 0 0)",
    "sidebarPrimary":            "oklch(0.205 0 0)",
    "sidebarPrimaryForeground":  "oklch(0.985 0 0)",
    "sidebarAccent":             "oklch(0.97 0 0)",
    "sidebarAccentForeground":   "oklch(0.205 0 0)",
    "sidebarBorder":             "oklch(0.922 0 0)",
    "sidebarRing":               "oklch(0.708 0 0)"
  },

  "typography": {
    "fontFamily": { "sans": "var(--font-sans)", "mono": "'JetBrains Mono', ui-monospace, monospace" },
    "fontSize":   { "xs": "0.75rem", "sm": "0.875rem", "base": "1rem", "lg": "1.125rem", "xl": "1.25rem", "2xl": "1.5rem" },
    "fontWeight": { "normal": "400", "medium": "500", "semibold": "600", "bold": "700" }
  },

  "geometry": {
    "radiusBase": "0.625rem",
    "radiusScale": { "sm": 0.6, "md": 0.8, "lg": 1.0, "xl": 1.4, "2xl": 1.8, "3xl": 2.2, "4xl": 2.6 },
    "shadow": {
      "sm": "0 1px 2px rgba(0,0,0,0.05)",
      "md": "0 4px 6px -1px rgba(0,0,0,0.1)"
    }
  },

  "components": {
    "card": { "radius": "md", "shadow": "sm" },
    "filter": { "radius": "sm", "height": "2rem" },
    "tab": { "railRadius": "lg", "pillRadius": "md" },
    "pill": { "radius": "sm" }
  },
  "dashboard": {
    "filterBar": { "bg": "#f0f2f5", "border": "#f0f0f0" },
    "filterTrigger": { "bg": "#f8f9fa", "border": "#f0f0f0", "text": "#6b7280", "hoverBg": "#f1f3f5", "hoverBorder": "#e5e7eb" },
    "filterActive": { "bg": "#eff6ff", "border": "#1e40af", "text": "#1e40af" },
    "filterBadge": { "bg": "#1e40af", "text": "#ffffff" },
    "table": { "headerText": "#6b7280", "cellText": "#111827", "cellSecondary": "#6b7280" },
    "tab": { "rail": "#f1f3f5", "text": "#9ca3af", "hoverText": "#6b7280", "activeBg": "#ffffff", "activeText": "#111827" },
    "heading": { "primary": "#111827", "section": "#6b7280", "overline": "#9ca3af" }
  },

  "viz": {
    "categorical": ["oklch(0.809 0.105 251.813)", "oklch(0.623 0.214 259.815)", "oklch(0.546 0.245 262.881)", "oklch(0.488 0.243 264.376)", "oklch(0.424 0.199 265.638)"],
    "sequential":  ["oklch(0.809 0.105 251.813)", "oklch(0.623 0.214 259.815)", "oklch(0.546 0.245 262.881)"],
    "diverging":   ["oklch(0.577 0.245 27.325)", "oklch(0.809 0.105 251.813)", "oklch(0.424 0.199 265.638)"]
  }
}
